[
  {
    "claim_id": "LCM-04-CL-001",
    "module_id": "filtering",
    "claim": "Every voluntary action filters the range that reaches the next decision, so later streets must be evaluated against the surviving range rather than the original preflop range.",
    "source_refs": [
      "sources/carrot-poker/transcripts/CP_G2_L07_facing_bets_and_range_thresholds.md",
      "sources/carrot-poker/transcripts/CP_G3_L02_mixing_continued_bet_check.md",
      "sources/ftgu/transcripts/FTGU_E07_selective_vs_unselective_cbetting.md"
    ],
    "interpretation": "The trainer should explicitly rebuild the opponent range after calls, bets, checks and raises before evaluating the next board or size.",
    "claim_type": "BASELINE",
    "confidence": "HIGH",
    "assumptions": ["The prior action was voluntary and strategically informative", "The action did not force the entire source range to continue identically"],
    "exceptions": ["Near-range actions can filter less than selective actions", "Exact combo survival depends on the actual source range and sizing"],
    "target_games": ["Live cash 1/3", "Live cash 2/5"],
    "depth_scope": ["All non-all-in depths"],
    "positions": ["All positions"],
    "player_count_scope": "BOTH",
    "sizing_scope": ["Bet, call, check and raise branches"],
    "rake_or_structure_notes": [],
    "conflicts": [],
    "ip_purity_status": "PRODUCT_SAFE_CANDIDATE",
    "status": "ADMITTED",
    "reviewer": "GPT-5.6 Thinking",
    "reviewed_at": "2026-08-07",
    "notes": "Mechanism-level claim; no exact combo counts are admitted."
  },
  {
    "claim_id": "LCM-04-CL-002",
    "module_id": "filtering",
    "claim": "A successful exploit on one street must be re-evaluated after the opponent continues because the continuation selects a stronger and differently composed branch.",
    "source_refs": [
      "sources/smash-live-cash/transcripts/SLC_M03_L25_preflop_adjustments_vs_locked_3bet_ranges_part_2.md",
      "sources/ftgu/transcripts/FTGU_E07_selective_vs_unselective_cbetting.md"
    ],
    "interpretation": "A wide flop bluff exploit against an over-folder is not a licence to keep over-bluffing the turn after the over-folder calls.",
    "claim_type": "HEURISTIC",
    "confidence": "HIGH",
    "assumptions": ["The exploit targets a fold-heavy branch", "Villain has now taken a continuing action"],
    "exceptions": ["A turn card can create a new independent exploit", "Some callers may continue too wide and preserve substantial weak material"],
    "target_games": ["Live cash 1/3", "Live cash 2/5"],
    "depth_scope": ["All depths with later-street decisions"],
    "positions": ["All positions"],
    "player_count_scope": "BOTH",
    "sizing_scope": ["Multi-street betting branches"],
    "rake_or_structure_notes": [],
    "conflicts": [],
    "ip_purity_status": "PRODUCT_SAFE_CANDIDATE",
    "status": "ADMITTED",
    "reviewer": "GPT-5.6 Thinking",
    "reviewed_at": "2026-08-07",
    "notes": "Branch-reset heuristic, not a universal instruction to stop betting."
  },
  {
    "claim_id": "LCM-04-CL-003",
    "module_id": "filtering",
    "claim": "A check is also a range-shaping action and does not automatically cap the checking range because strong hands may remain there for protection or EV reasons.",
    "source_refs": [
      "sources/ftgu/transcripts/FTGU_E07_selective_vs_unselective_cbetting.md",
      "sources/carrot-poker/transcripts/CP_G3_L02_mixing_continued_bet_check.md"
    ],
    "interpretation": "The learner should update after a check without converting the opponent instantly into a weak or capped range.",
    "claim_type": "BASELINE",
    "confidence": "HIGH",
    "assumptions": ["The strategy can contain both bets and checks", "No strong population read proves that checks are unprotected"],
    "exceptions": ["Some opponents do in fact cap checks heavily", "Some range-bet nodes leave little meaningful checking information"],
    "target_games": ["Live cash 1/3", "Live cash 2/5"],
    "depth_scope": ["All depths"],
    "positions": ["All positions"],
    "player_count_scope": "BOTH",
    "sizing_scope": ["Bet-versus-check branches"],
    "rake_or_structure_notes": [],
    "conflicts": [],
    "ip_purity_status": "PRODUCT_SAFE_CANDIDATE",
    "status": "ADMITTED",
    "reviewer": "GPT-5.6 Thinking",
    "reviewed_at": "2026-08-07",
    "notes": "Exact protected-check composition remains node-specific."
  },
  {
    "claim_id": "LCM-04-CL-004",
    "module_id": "filtering",
    "claim": "Blockers should be evaluated after the current range state and action candidacy are established; they select among plausible actions rather than create an action by themselves.",
    "source_refs": ["sources/carrot-poker/transcripts/CP_G3_L03_common_blocker_effects.md"],
    "interpretation": "Before using a blocker on the river or in a bluff branch, reconstruct the value and fold/bluff regions that can actually be present after the prior action history.",
    "claim_type": "BASELINE",
    "confidence": "HIGH",
    "assumptions": ["The current action is not already pure for stronger range-level reasons", "Relevant Villain value/fold regions can be described"],
    "exceptions": ["Blocker effects can be decisive near a genuine mixed boundary"],
    "target_games": ["Live cash 1/3", "Live cash 2/5"],
    "depth_scope": ["All depths"],
    "positions": ["All positions"],
    "player_count_scope": "BOTH",
    "sizing_scope": ["Bluffing and bluff-catching branches"],
    "rake_or_structure_notes": [],
    "conflicts": [],
    "ip_purity_status": "PRODUCT_SAFE_CANDIDATE",
    "status": "ADMITTED",
    "reviewer": "GPT-5.6 Thinking",
    "reviewed_at": "2026-08-07",
    "notes": "Blocker is a final selector, not first-principles strategy."
  }
]
