[
  {
    "claim_id": "LCM-07-CL-001",
    "module_id": "ancestry",
    "claim": "The preflop source range constrains the bluff and value combinations available on later streets, so later decisions must begin from the branch that actually reached the current node.",
    "source_refs": ["sources/smash-live-cash/transcripts/SLC_M03_L24_preflop_adjustments_vs_locked_3bet_ranges_part_1.md"],
    "interpretation": "A value-heavy preflop 3-bet range that omits low suited bluffs arrives postflop with fewer natural barrel candidates than a baseline polar range.",
    "claim_type": "BASELINE",
    "confidence": "HIGH",
    "assumptions": ["The preflop range composition is meaningfully different across the compared profiles", "The omitted combos are relevant to later bluff construction"],
    "exceptions": ["Villain can compensate by bluffing stronger or different hand classes later", "Exact combo reach remains chart- and board-dependent"],
    "target_games": ["Live cash 1/3", "Live cash 2/5"],
    "depth_scope": ["Standard and deep 3-bet pots"],
    "positions": ["All positions with known preflop source range"],
    "player_count_scope": "HEADS_UP",
    "sizing_scope": ["3-bet and later betting branches"],
    "rake_or_structure_notes": [],
    "conflicts": [],
    "ip_purity_status": "PRODUCT_SAFE_CANDIDATE",
    "status": "ADMITTED",
    "reviewer": "GPT-5.6 Thinking",
    "reviewed_at": "2026-08-07",
    "notes": "Range ancestry mechanism; no exact late-street combo count is claimed."
  },
  {
    "claim_id": "LCM-07-CL-002",
    "module_id": "ancestry",
    "claim": "An over-wide preflop range carries extra weak material into later streets and must alter later betting frequencies; the current range cannot be inferred from the action label alone.",
    "source_refs": [
      "sources/smash-live-cash/transcripts/SLC_M03_L25_preflop_adjustments_vs_locked_3bet_ranges_part_2.md",
      "sources/smash-live-cash/transcripts/SLC_M03_L26_preflop_adjustments_vs_locked_3bet_ranges_part_3.md"
    ],
    "interpretation": "The label '3-bettor' is insufficient. The learner should ask which hands entered preflop and how the player compensated after reaching the flop.",
    "claim_type": "HEURISTIC",
    "confidence": "HIGH",
    "assumptions": ["Villain's preflop range is known or credibly estimated as wider than baseline", "Later frequencies depend on that composition"],
    "exceptions": ["A strong board-specific range advantage can still support substantial aggression", "A sophisticated Villain can compensate correctly"],
    "target_games": ["Live cash 1/3", "Live cash 2/5"],
    "depth_scope": ["Standard and deep 3-bet pots"],
    "positions": ["All 3-bet-pot positions"],
    "player_count_scope": "HEADS_UP",
    "sizing_scope": ["Preflop 3-bet through later streets"],
    "rake_or_structure_notes": [],
    "conflicts": [],
    "ip_purity_status": "PRODUCT_SAFE_CANDIDATE",
    "status": "ADMITTED",
    "reviewer": "GPT-5.6 Thinking",
    "reviewed_at": "2026-08-07",
    "notes": "Profile-specific mechanism, not a universal population frequency."
  },
  {
    "claim_id": "LCM-07-CL-003",
    "module_id": "ancestry",
    "claim": "Blockers refine decisions only after the current range state and the candidate actions are established; they cannot manufacture value or bluff combinations that the branch history removed.",
    "source_refs": ["sources/carrot-poker/transcripts/CP_G3_L03_common_blocker_effects.md"],
    "interpretation": "On river calls, raises or preflop reraises, first identify the surviving value and bluff/fold regions, then use blockers to choose among otherwise plausible actions.",
    "claim_type": "BASELINE",
    "confidence": "HIGH",
    "assumptions": ["The learner can reconstruct the relevant branch before applying card-removal logic", "The action is not already pure for stronger reasons"],
    "exceptions": ["Near a genuine mixed boundary, blocker effects can be the decisive selector"],
    "target_games": ["Live cash 1/3", "Live cash 2/5"],
    "depth_scope": ["All depths"],
    "positions": ["All positions"],
    "player_count_scope": "BOTH",
    "sizing_scope": ["Bluffing, bluff-catching and reraising branches"],
    "rake_or_structure_notes": [],
    "conflicts": [],
    "ip_purity_status": "PRODUCT_SAFE_CANDIDATE",
    "status": "ADMITTED",
    "reviewer": "GPT-5.6 Thinking",
    "reviewed_at": "2026-08-07",
    "notes": "Blocker follows ancestry."
  },
  {
    "claim_id": "LCM-07-CL-004",
    "module_id": "ancestry",
    "claim": "Opponent tendencies must be stored by branch rather than collapsed into one global label because preflop looseness, flop aggression and later-street follow-through can differ materially.",
    "source_refs": [
      "sources/smash-live-cash/transcripts/SLC_M03_L24_preflop_adjustments_vs_locked_3bet_ranges_part_1.md",
      "sources/smash-live-cash/transcripts/SLC_M03_L25_preflop_adjustments_vs_locked_3bet_ranges_part_2.md"
    ],
    "interpretation": "A player can be too tight in one 3-bet branch, too wide in another, and fail to make the postflop compensation implied by either profile. The model should record the action-specific behaviour.",
    "claim_type": "EXPLOIT",
    "confidence": "HIGH",
    "assumptions": ["There are repeated observations or a clearly defined profile", "The observation is tied to a specific action branch"],
    "exceptions": ["Sparse evidence should remain low confidence", "A global label is acceptable only as shorthand after branch-level evidence agrees"],
    "target_games": ["Live cash 1/3", "Live cash 2/5"],
    "depth_scope": ["All depths"],
    "positions": ["All positions"],
    "player_count_scope": "BOTH",
    "sizing_scope": ["Opponent-model branches"],
    "rake_or_structure_notes": [],
    "conflicts": [],
    "ip_purity_status": "PRODUCT_SAFE_CANDIDATE",
    "status": "ADMITTED",
    "reviewer": "GPT-5.6 Thinking",
    "reviewed_at": "2026-08-07",
    "notes": "Exploit model stays branch-specific and confidence-gated."
  }
]
