[
  {
    "claim_id": "LCM-11-CL-001",
    "module_id": "transfer",
    "claim": "In Live Cash OS, completing lesson content does not create mastery; working, retained and field-validated states require distinct evidence dimensions.",
    "source_refs": ["apps/live-cash-os/lib/model-core.ts#deriveModuleState", "governance/CROSS_SOURCE_VALIDATION_AND_ADMISSION_FRAMEWORK_v0_1.md#field-evidence-interaction"],
    "interpretation": "The learner-facing module should explain the product's evidence contract rather than imply that finishing a lesson proves durable skill.",
    "claim_type": "SIMPLIFICATION",
    "confidence": "HIGH",
    "assumptions": ["The current learner-state integrity model is the product authority", "Statuses are descriptions of product evidence, not scientific diagnoses"],
    "exceptions": ["Thresholds may be recalibrated after Wave 10 real-use evidence without collapsing the dimensions"],
    "target_games": ["Live cash training"],
    "depth_scope": ["Not applicable"],
    "positions": ["Learning workflow"],
    "player_count_scope": "NOT_APPLICABLE",
    "sizing_scope": ["Learning evidence"],
    "rake_or_structure_notes": [],
    "conflicts": [],
    "ip_purity_status": "PRODUCT_SAFE_CANDIDATE",
    "status": "ADMITTED",
    "reviewer": "GPT-5.6 Thinking",
    "reviewed_at": "2026-08-07",
    "notes": "Product evidence semantics, not an external efficacy claim."
  },
  {
    "claim_id": "LCM-11-CL-002",
    "module_id": "transfer",
    "claim": "Variant-transfer evidence is created only by an explicitly declared changed-node probe with recorded changed variables; ordinary review or repair success does not imply transfer.",
    "source_refs": ["apps/live-cash-os/lib/model-core.ts#normalizeTransferProbe", "apps/live-cash-os/lib/model-core.ts#recordDecision"],
    "interpretation": "A transfer check must preserve the mechanism while changing a strategically material variable such as position, depth, action order or sizing.",
    "claim_type": "BASELINE",
    "confidence": "HIGH",
    "assumptions": ["The probe is explicitly registered", "Changed variables are material to the decision"],
    "exceptions": ["A poorly chosen cosmetic variant should not be treated as meaningful transfer even if marked"],
    "target_games": ["Live cash training"],
    "depth_scope": ["All trained depths"],
    "positions": ["All trained positions"],
    "player_count_scope": "NOT_APPLICABLE",
    "sizing_scope": ["Changed-node assessment"],
    "rake_or_structure_notes": [],
    "conflicts": [],
    "ip_purity_status": "PRODUCT_SAFE_CANDIDATE",
    "status": "ADMITTED",
    "reviewer": "GPT-5.6 Thinking",
    "reviewed_at": "2026-08-07",
    "notes": "Matches runtime evidence semantics."
  },
  {
    "claim_id": "LCM-11-CL-003",
    "module_id": "transfer",
    "claim": "Retention evidence is recorded only when a delayed review item is actually due; an immediate correct response after instruction or repair does not count as retention.",
    "source_refs": ["apps/live-cash-os/lib/model-core.ts#queueReview", "apps/live-cash-os/lib/model-core.ts#recordDecision"],
    "interpretation": "The learner-facing copy should distinguish 'I can do it now' from 'I retrieved it after a delay'.",
    "claim_type": "BASELINE",
    "confidence": "HIGH",
    "assumptions": ["The review queue and due time are functioning", "The response is recorded through the current evidence model"],
    "exceptions": ["Wave 10 may recalibrate delay lengths while retaining the separation between immediate and delayed evidence"],
    "target_games": ["Live cash training"],
    "depth_scope": ["Not applicable"],
    "positions": ["Learning workflow"],
    "player_count_scope": "NOT_APPLICABLE",
    "sizing_scope": ["Delayed review"],
    "rake_or_structure_notes": [],
    "conflicts": [],
    "ip_purity_status": "PRODUCT_SAFE_CANDIDATE",
    "status": "ADMITTED",
    "reviewer": "GPT-5.6 Thinking",
    "reviewed_at": "2026-08-07",
    "notes": "Current initial retention delay is one day."
  },
  {
    "claim_id": "LCM-11-CL-004",
    "module_id": "transfer",
    "claim": "Field validation requires reviewed real-hand evidence plus prior retention and variant-transfer evidence; a raw note, one hand or the pot result cannot validate the skill.",
    "source_refs": ["apps/live-cash-os/lib/model-core.ts#reviewFieldNote", "apps/live-cash-os/lib/model-core.ts#deriveModuleState"],
    "interpretation": "The product currently requires at least two reviewed valid field successes on distinct notes together with retention and variant-transfer evidence before FIELD_VALIDATED.",
    "claim_type": "BASELINE",
    "confidence": "HIGH",
    "assumptions": ["Field notes are reviewed against the mechanism", "The cue was recorded as noticed before action for valid field evidence"],
    "exceptions": ["The exact threshold may be recalibrated after sustained learner evidence, but raw notes must remain distinct from validation"],
    "target_games": ["Live cash training and reviewed real hands"],
    "depth_scope": ["All trained depths"],
    "positions": ["All trained positions"],
    "player_count_scope": "NOT_APPLICABLE",
    "sizing_scope": ["Field evidence"],
    "rake_or_structure_notes": [],
    "conflicts": [],
    "ip_purity_status": "PRODUCT_SAFE_CANDIDATE",
    "status": "ADMITTED",
    "reviewer": "GPT-5.6 Thinking",
    "reviewed_at": "2026-08-07",
    "notes": "Product contract, not a universal learning-science threshold."
  }
]
