[
  {
    "claim_id": "LCM-06-CL-001",
    "module_id": "aggression",
    "claim": "An over-wide preflop 3-bet range should use more postflop checks than a stronger baseline range; failing to compensate makes the betting branch too weak.",
    "source_refs": [
      "sources/smash-live-cash/transcripts/SLC_M03_L25_preflop_adjustments_vs_locked_3bet_ranges_part_2.md",
      "sources/smash-live-cash/transcripts/SLC_M03_L26_preflop_adjustments_vs_locked_3bet_ranges_part_3.md"
    ],
    "interpretation": "Postflop decisions must remain consistent with the actual preflop range shape rather than the label '3-bettor'.",
    "claim_type": "EXPLOIT",
    "confidence": "HIGH",
    "assumptions": ["Villain genuinely 3-bets wider than baseline", "Villain does not fully compensate by checking more"],
    "exceptions": ["Some boards still strongly favour the 3-bettor", "The adjustment shrinks when Villain compensates correctly"],
    "target_games": ["Live cash 1/3", "Live cash 2/5"],
    "depth_scope": ["150-200bb", "Deep live cash"],
    "positions": ["Heads-up 3-bet pots"],
    "player_count_scope": "HEADS_UP",
    "sizing_scope": ["Flop continuation-bet branches"],
    "rake_or_structure_notes": [],
    "conflicts": [],
    "ip_purity_status": "PRODUCT_SAFE_CANDIDATE",
    "status": "ADMITTED",
    "reviewer": "GPT-5.6 Thinking",
    "reviewed_at": "2026-08-07",
    "notes": "Exact boards, sizes and frequencies remain visual-dependent."
  },
  {
    "claim_id": "LCM-06-CL-002",
    "module_id": "aggression",
    "claim": "Dry high-card and paired flops can preserve enough premium-range advantage for frequent small betting, while coordinated middling flops require a more selective strategy.",
    "source_refs": [
      "sources/ftgu/transcripts/FTGU_E28_high_frequency_betting_3bet_pots.md",
      "sources/ftgu/transcripts/FTGU_E29_selective_strategies_3bet_pots.md"
    ],
    "interpretation": "The learner should test whether the preflop range advantage survived the actual board before choosing a wide or selective betting plan.",
    "claim_type": "HEURISTIC",
    "confidence": "HIGH",
    "assumptions": ["The 3-bet range is broadly baseline-shaped", "Board interaction is evaluated at range level"],
    "exceptions": ["Exact board classes and frequencies require visual review", "Opponent-specific range construction can change ownership"],
    "target_games": ["Live cash 1/3", "Live cash 2/5"],
    "depth_scope": ["Standard and deep 3-bet pots"],
    "positions": ["3-bettor versus caller"],
    "player_count_scope": "HEADS_UP",
    "sizing_scope": ["Small high-frequency betting", "Selective flop betting"],
    "rake_or_structure_notes": [],
    "conflicts": [],
    "ip_purity_status": "PRODUCT_SAFE_CANDIDATE",
    "status": "ADMITTED",
    "reviewer": "GPT-5.6 Thinking",
    "reviewed_at": "2026-08-07",
    "notes": "No fixed size or frequency is admitted."
  },
  {
    "claim_id": "LCM-06-CL-003",
    "module_id": "aggression",
    "claim": "After a high-frequency flop bet is called, the defender has already filtered weak hands, so the turn strategy must be rebuilt rather than copied from the flop.",
    "source_refs": ["sources/ftgu/transcripts/FTGU_E28_high_frequency_betting_3bet_pots.md"],
    "interpretation": "A wide flop bet is a one-street consequence of range advantage, not an automatic multi-street plan.",
    "claim_type": "BASELINE",
    "confidence": "HIGH",
    "assumptions": ["The flop was bet at high frequency", "The defender called"],
    "exceptions": ["Some turn cards can create a new strong range advantage"],
    "target_games": ["Live cash 1/3", "Live cash 2/5"],
    "depth_scope": ["3-bet pots with meaningful turn decisions"],
    "positions": ["3-bettor versus caller"],
    "player_count_scope": "HEADS_UP",
    "sizing_scope": ["Flop bet followed by call"],
    "rake_or_structure_notes": [],
    "conflicts": [],
    "ip_purity_status": "PRODUCT_SAFE_CANDIDATE",
    "status": "ADMITTED",
    "reviewer": "GPT-5.6 Thinking",
    "reviewed_at": "2026-08-07",
    "notes": "Turn-card specifics remain node-dependent."
  },
  {
    "claim_id": "LCM-06-CL-004",
    "module_id": "aggression",
    "claim": "Out-of-position raising in a 3-bet pot requires a credible top-end value region; equity denial can support a valid raise candidate but cannot create the value foundation by itself.",
    "source_refs": ["sources/carrot-poker/transcripts/CP_G3_L09_defending_3bet_pots_oop.md"],
    "interpretation": "Check for top-end holdings before constructing a raise or low-SPR jam branch.",
    "claim_type": "BASELINE",
    "confidence": "HIGH",
    "assumptions": ["Hero defends OOP in a 3-bet pot", "Exact tier boundaries are not required"],
    "exceptions": ["Some textures remove the raise branch almost entirely", "Exact combo selection remains solver-visual dependent"],
    "target_games": ["Live cash 1/3", "Live cash 2/5"],
    "depth_scope": ["Low-SPR and standard 3-bet pots"],
    "positions": ["OOP defender"],
    "player_count_scope": "HEADS_UP",
    "sizing_scope": ["Flop raises", "Low-SPR turn all-ins"],
    "rake_or_structure_notes": [],
    "conflicts": [],
    "ip_purity_status": "PRODUCT_SAFE_CANDIDATE",
    "status": "ADMITTED",
    "reviewer": "GPT-5.6 Thinking",
    "reviewed_at": "2026-08-07",
    "notes": "Mechanism-level admission only."
  }
]
