[
  {
    "claim_id": "LCM-05-CL-001",
    "module_id": "shape",
    "claim": "Bet-size architecture should be selected from the value region and opponent range shape before bluff allocation or hand-level randomisation.",
    "source_refs": [
      "sources/carrot-poker/transcripts/CP_G2_L02_bet_sizing_and_value_tiers.md",
      "sources/carrot-poker/transcripts/CP_G3_L02_mixing_continued_bet_check.md"
    ],
    "interpretation": "The learner should ask what the value region can profitably invest and what the opponent can continue with before choosing a size.",
    "claim_type": "BASELINE",
    "confidence": "HIGH",
    "assumptions": ["A betting branch exists", "The value region and opponent continuing region can be described"],
    "exceptions": ["Exact solver size menus and EV differences remain visual-dependent", "Exploitative sizing can deliberately depart from the baseline toolkit"],
    "target_games": ["Live cash 1/3", "Live cash 2/5"],
    "depth_scope": ["All non-all-in depths"],
    "positions": ["All positions"],
    "player_count_scope": "BOTH",
    "sizing_scope": ["Flop, turn and river betting"],
    "rake_or_structure_notes": [],
    "conflicts": [],
    "ip_purity_status": "PRODUCT_SAFE_CANDIDATE",
    "status": "ADMITTED",
    "reviewer": "GPT-5.6 Thinking",
    "reviewed_at": "2026-08-07",
    "notes": "Value-first sizing principle; no exact size table is admitted."
  },
  {
    "claim_id": "LCM-05-CL-002",
    "module_id": "shape",
    "claim": "Low betting frequency does not by itself imply a large bet size; size follows the value ceiling, polarisation and opponent range shape rather than frequency alone.",
    "source_refs": ["sources/carrot-poker/transcripts/CP_G2_L02_bet_sizing_and_value_tiers.md"],
    "interpretation": "Do not infer 'rare bet equals polar overbet'. A range can bet infrequently with medium value that still prefers a moderate size.",
    "claim_type": "HEURISTIC",
    "confidence": "HIGH",
    "assumptions": ["The value region is not automatically nutted", "Opponent continues differ by size"],
    "exceptions": ["Highly polarised value regions can support very large sizes", "Exact size/frequency pairings are node-specific"],
    "target_games": ["Live cash 1/3", "Live cash 2/5"],
    "depth_scope": ["All depths"],
    "positions": ["All positions"],
    "player_count_scope": "BOTH",
    "sizing_scope": ["Bet-size selection"],
    "rake_or_structure_notes": [],
    "conflicts": [],
    "ip_purity_status": "PRODUCT_SAFE_CANDIDATE",
    "status": "ADMITTED",
    "reviewer": "GPT-5.6 Thinking",
    "reviewed_at": "2026-08-07",
    "notes": "Frequency and size are separate decisions."
  },
  {
    "claim_id": "LCM-05-CL-003",
    "module_id": "shape",
    "claim": "Against a small merged or near-range bet, some vulnerable made hands can raise for value and equity denial, while robust strong hands may remain in the calling range to protect future decisions.",
    "source_refs": [
      "sources/ftgu/transcripts/FTGU_E09_polarised_flop_raising.md",
      "sources/ftgu/transcripts/FTGU_E10_merged_flop_raising.md",
      "sources/carrot-poker/transcripts/CP_G2_L02_bet_sizing_and_value_tiers.md"
    ],
    "interpretation": "Raise construction is not a simple hand-strength ranking. The raise needs worse continues or meaningful denial, and the call range still needs strong hands.",
    "claim_type": "BASELINE",
    "confidence": "HIGH",
    "assumptions": ["Villain uses a sufficiently wide or merged betting range", "Hero has a legitimate raising branch"],
    "exceptions": ["Against a strong polar bet, thin merged raises can shrink sharply", "Exact hand classes remain board- and range-dependent"],
    "target_games": ["Live cash 1/3", "Live cash 2/5"],
    "depth_scope": ["Standard and deep postflop pots"],
    "positions": ["All positions"],
    "player_count_scope": "BOTH",
    "sizing_scope": ["Small merged bets", "Selective larger bets"],
    "rake_or_structure_notes": [],
    "conflicts": [],
    "ip_purity_status": "PRODUCT_SAFE_CANDIDATE",
    "status": "ADMITTED",
    "reviewer": "GPT-5.6 Thinking",
    "reviewed_at": "2026-08-07",
    "notes": "No exact board/hand prescription is admitted."
  },
  {
    "claim_id": "LCM-05-CL-004",
    "module_id": "shape",
    "claim": "A practical size toolkit may simplify to one bet size when strategic EV is preserved, but simplification must be tested against value-region needs rather than assumed universally.",
    "source_refs": ["sources/carrot-poker/transcripts/CP_G3_L02_mixing_continued_bet_check.md"],
    "interpretation": "The trainer should favour executable size families while preserving the reason a size exists, rather than mimic every solver output or claim that one size is always enough.",
    "claim_type": "SIMPLIFICATION",
    "confidence": "HIGH",
    "assumptions": ["The reduced toolkit preserves the important value and bluff functions", "No known second value tier requires a materially different size"],
    "exceptions": ["River and strongly split value regions may require multiple sizes", "Exact EV-retention tests remain solver-visual dependent"],
    "target_games": ["Live cash 1/3", "Live cash 2/5"],
    "depth_scope": ["All depths"],
    "positions": ["All positions"],
    "player_count_scope": "BOTH",
    "sizing_scope": ["Human-executable bet-size toolkit"],
    "rake_or_structure_notes": [],
    "conflicts": [],
    "ip_purity_status": "PRODUCT_SAFE_CANDIDATE",
    "status": "ADMITTED",
    "reviewer": "GPT-5.6 Thinking",
    "reviewed_at": "2026-08-07",
    "notes": "Simplification is conditional, not universal."
  }
]
