[
  {
    "claim_id": "LCM-08-CL-001",
    "module_id": "multiway",
    "claim": "Multiway defence is shared across live ranges, so a player acting between the bettor and an uncapped range behind should defend more cautiously than a comparable closing-action player.",
    "source_refs": ["sources/smash-live-cash/transcripts/SLC_M04_L36_multiway_sandwich_and_triton_hand_analysis.md", "sources/smash-live-cash/transcripts/SLC_M04_L40_multiway_flop_mechanics_kt9ss_part_1.md"],
    "interpretation": "The trainer should put action order and the live range behind ahead of heads-up defence slogans or one-player MDF reasoning.",
    "claim_type": "BASELINE",
    "confidence": "HIGH",
    "assumptions": ["At least three players remain in the pot", "A meaningful range is still left to act behind Hero"],
    "exceptions": ["A closing player has no unseen range behind", "Exact defence frequencies remain node- and size-specific"],
    "target_games": ["Live cash 1/3", "Live cash 2/5"],
    "depth_scope": ["All multiway depths"],
    "positions": ["All multiway positions"],
    "player_count_scope": "MULTIWAY",
    "sizing_scope": ["Flop and later-street bet/call/raise branches"],
    "rake_or_structure_notes": [],
    "conflicts": [],
    "ip_purity_status": "PRODUCT_SAFE_CANDIDATE",
    "status": "ADMITTED",
    "reviewer": "GPT-5.6 Thinking",
    "reviewed_at": "2026-08-07",
    "notes": "Directional action-order mechanism; no exact MDF is claimed."
  },
  {
    "claim_id": "LCM-08-CL-002",
    "module_id": "multiway",
    "claim": "Preflop initiative does not determine postflop ownership by itself; board texture must be applied to the actual source ranges and their missing or retained nut combinations.",
    "source_refs": ["sources/smash-live-cash/transcripts/SLC_M04_L39_low_connected_flops_multiway.md", "sources/smash-live-cash/transcripts/SLC_M04_L40_multiway_flop_mechanics_kt9ss_part_1.md"],
    "interpretation": "A low connected board can strongly favour the big blind, while a broadway-connected board can still favour a tight opener that retains unique offsuit nut combinations.",
    "claim_type": "BASELINE",
    "confidence": "HIGH",
    "assumptions": ["The compared preflop ranges are known at least by shape", "Board interaction materially differs between those ranges"],
    "exceptions": ["Loose live overcalls can change exact ownership", "Exact frequencies and combo weights remain visual-dependent"],
    "target_games": ["Live cash 1/3", "Live cash 2/5"],
    "depth_scope": ["All multiway depths"],
    "positions": ["All multiway positions"],
    "player_count_scope": "MULTIWAY",
    "sizing_scope": ["Postflop ownership before betting"],
    "rake_or_structure_notes": [],
    "conflicts": [],
    "ip_purity_status": "PRODUCT_SAFE_CANDIDATE",
    "status": "ADMITTED",
    "reviewer": "GPT-5.6 Thinking",
    "reviewed_at": "2026-08-07",
    "notes": "Board labels never replace source-range comparison."
  },
  {
    "claim_id": "LCM-08-CL-003",
    "module_id": "multiway",
    "claim": "Small bets can gain extra leverage multiway because each defender must account for the other live ranges, but the size and frequency remain dependent on ownership and action order.",
    "source_refs": ["sources/smash-live-cash/transcripts/SLC_M04_L36_multiway_sandwich_and_triton_hand_analysis.md"],
    "interpretation": "The trainer may teach the directional leverage of small multiway bets without turning it into a universal range-bet rule.",
    "claim_type": "HEURISTIC",
    "confidence": "HIGH",
    "assumptions": ["Multiple defenders remain live", "The bettor has a strategically valid betting branch"],
    "exceptions": ["Some boards require high checking frequency", "Exact bet sizes and frequencies remain visual-dependent"],
    "target_games": ["Live cash 1/3", "Live cash 2/5"],
    "depth_scope": ["All multiway depths"],
    "positions": ["All positions"],
    "player_count_scope": "MULTIWAY",
    "sizing_scope": ["Small multiway bets"],
    "rake_or_structure_notes": [],
    "conflicts": [],
    "ip_purity_status": "PRODUCT_SAFE_CANDIDATE",
    "status": "ADMITTED",
    "reviewer": "GPT-5.6 Thinking",
    "reviewed_at": "2026-08-07",
    "notes": "Leverage is directional, not a fixed sizing prescription."
  },
  {
    "claim_id": "LCM-08-CL-004",
    "module_id": "multiway",
    "claim": "Multiway bluff and raise candidates require stronger backup equity and removal than random low-equity air, and exploit expansion should first increase already-coherent candidates.",
    "source_refs": ["sources/smash-live-cash/transcripts/SLC_M04_L36_multiway_sandwich_and_triton_hand_analysis.md"],
    "interpretation": "Because more strong ranges can collide with aggression, the trainer should prefer structurally supported candidates before adding arbitrary bluffs.",
    "claim_type": "HEURISTIC",
    "confidence": "HIGH",
    "assumptions": ["Hero is considering multiway aggression", "More than one opponent range can continue"],
    "exceptions": ["Specific closing-action nodes can support wider aggression", "Exact candidate ordering remains visual-dependent"],
    "target_games": ["Live cash 1/3", "Live cash 2/5"],
    "depth_scope": ["All multiway depths"],
    "positions": ["All positions"],
    "player_count_scope": "MULTIWAY",
    "sizing_scope": ["Multiway bets and raises"],
    "rake_or_structure_notes": [],
    "conflicts": [],
    "ip_purity_status": "PRODUCT_SAFE_CANDIDATE",
    "status": "ADMITTED",
    "reviewer": "GPT-5.6 Thinking",
    "reviewed_at": "2026-08-07",
    "notes": "No proprietary hand matrix is reproduced."
  }
]
