[
  {
    "claim_id": "LCM-09-CL-001",
    "module_id": "river",
    "claim": "River bluff-catching begins with origin range, prior filtering and credible surviving bluff supply before blocker quality is considered.",
    "source_refs": ["sources/carrot-poker/transcripts/CP_G2_L08_bluff_catching_system.md", "sources/cash-injection/transcripts/CINJ_E10_exploitative_folding_in_filtered_underbluffed_nodes.md"],
    "interpretation": "The learner should rebuild the value and natural bluff families that can actually reach the river rather than call because one card is an attractive blocker.",
    "claim_type": "BASELINE",
    "confidence": "HIGH",
    "assumptions": ["Hero faces a river bet or raise", "The prior action history materially filters ranges"],
    "exceptions": ["Near a genuine call/fold threshold, blocker effects can be decisive after the range audit"],
    "target_games": ["Live cash 1/3", "Live cash 2/5"],
    "depth_scope": ["All river depths"],
    "positions": ["All positions"],
    "player_count_scope": "BOTH",
    "sizing_scope": ["River bets, raises and jams"],
    "rake_or_structure_notes": [],
    "conflicts": [],
    "ip_purity_status": "PRODUCT_SAFE_CANDIDATE",
    "status": "ADMITTED",
    "reviewer": "GPT-5.6 Thinking",
    "reviewed_at": "2026-08-07",
    "notes": "Ancestry precedes blocker selection."
  },
  {
    "claim_id": "LCM-09-CL-002",
    "module_id": "river",
    "claim": "River call quality is size-, line- and range-dependent; a hand must be classified against the actual value and bluff regions rather than by absolute hand strength.",
    "source_refs": ["sources/carrot-poker/transcripts/CP_G3_L05_calling_bets.md", "sources/smash-live-cash/transcripts/SLC_M02_L20_bluff_catchers_big_money.md"],
    "interpretation": "Value beaters, bluff catchers and frail hands can change class when the represented value range or size changes.",
    "claim_type": "BASELINE",
    "confidence": "HIGH",
    "assumptions": ["The relevant opposing value and bluff regions can be described", "The bet size changes the required defence threshold"],
    "exceptions": ["Exact hand thresholds and EVs remain visual- and solver-dependent"],
    "target_games": ["Live cash 1/3", "Live cash 2/5"],
    "depth_scope": ["All river depths"],
    "positions": ["All positions"],
    "player_count_scope": "BOTH",
    "sizing_scope": ["All river sizes"],
    "rake_or_structure_notes": [],
    "conflicts": [],
    "ip_purity_status": "PRODUCT_SAFE_CANDIDATE",
    "status": "ADMITTED",
    "reviewer": "GPT-5.6 Thinking",
    "reviewed_at": "2026-08-07",
    "notes": "Call and raise thresholds remain separate."
  },
  {
    "claim_id": "LCM-09-CL-003",
    "module_id": "river",
    "claim": "A blocker can worsen a bluff-catch when it removes more of the opponent's natural bluff region than value, so a context-free 'nut blocker is best' rule is invalid.",
    "source_refs": ["sources/carrot-poker/transcripts/CP_G3_L03_common_blocker_effects.md"],
    "interpretation": "For calling, blockers are useful when they block value and unblock bluffs; the opposite functions are harmful.",
    "claim_type": "BASELINE",
    "confidence": "HIGH",
    "assumptions": ["The opponent's relevant value and bluff families are already identified", "The blocker materially removes combinations from those families"],
    "exceptions": ["On some textures one blocker can strongly reduce concentrated value without removing bluffs"],
    "target_games": ["Live cash 1/3", "Live cash 2/5"],
    "depth_scope": ["All river depths"],
    "positions": ["All positions"],
    "player_count_scope": "BOTH",
    "sizing_scope": ["River bluff-catching"],
    "rake_or_structure_notes": [],
    "conflicts": [],
    "ip_purity_status": "PRODUCT_SAFE_CANDIDATE",
    "status": "ADMITTED",
    "reviewer": "GPT-5.6 Thinking",
    "reviewed_at": "2026-08-07",
    "notes": "Blocker functions are range-relative."
  },
  {
    "claim_id": "LCM-09-CL-004",
    "module_id": "river",
    "claim": "Strong evidence that a specific heavily filtered branch is underbluffed can justify folding theoretical bluff catchers, but population magnitude must remain field-gated.",
    "source_refs": ["sources/carrot-poker/transcripts/CP_G2_L08_bluff_catching_system.md", "sources/cash-injection/transcripts/CINJ_E10_exploitative_folding_in_filtered_underbluffed_nodes.md"],
    "interpretation": "Use theory as a baseline, then override only the exact branch when credible player or pool evidence supports too little bluff supply.",
    "claim_type": "EXPLOIT",
    "confidence": "HIGH",
    "assumptions": ["The line is sufficiently defined", "Observed or source-supported evidence points to underbluffing in that branch"],
    "exceptions": ["Creative or aggressive opponents can supply enough bluffs", "Batumi population magnitude is not yet validated"],
    "target_games": ["Live cash 1/3", "Live cash 2/5"],
    "depth_scope": ["All river depths"],
    "positions": ["All positions"],
    "player_count_scope": "BOTH",
    "sizing_scope": ["Filtered river aggression"],
    "rake_or_structure_notes": [],
    "conflicts": ["Exact Batumi underbluff frequency remains field-validation pending"],
    "ip_purity_status": "PRODUCT_SAFE_CANDIDATE",
    "status": "ADMITTED",
    "reviewer": "GPT-5.6 Thinking",
    "reviewed_at": "2026-08-07",
    "notes": "Branch-specific exploit only."
  }
]
