[
  {
    "claim_id": "LCM-10-CL-001",
    "module_id": "evidence",
    "claim": "A population or opponent read must remain attached to the action branch that generated it; global labels are weaker than position-, action-, size- and line-specific evidence.",
    "source_refs": ["sources/carrot-poker/transcripts/CP_G2_L08_bluff_catching_system.md", "sources/carrot-poker/transcripts/CP_G3_L05_calling_bets.md", "governance/CROSS_SOURCE_VALIDATION_AND_ADMISSION_FRAMEWORK_v0_1.md#field-evidence-interaction"],
    "interpretation": "The trainer should store the observed node and consequence rather than convert one tendency into a universal player type.",
    "claim_type": "BASELINE",
    "confidence": "HIGH",
    "assumptions": ["The observation can be tied to a concrete decision branch", "Different branches can contain different range construction"],
    "exceptions": ["A global shorthand is acceptable only after multiple branch observations support it"],
    "target_games": ["Live cash 1/3", "Live cash 2/5"],
    "depth_scope": ["All depths"],
    "positions": ["All positions"],
    "player_count_scope": "BOTH",
    "sizing_scope": ["Opponent-model and population branches"],
    "rake_or_structure_notes": [],
    "conflicts": [],
    "ip_purity_status": "PRODUCT_SAFE_CANDIDATE",
    "status": "ADMITTED",
    "reviewer": "GPT-5.6 Thinking",
    "reviewed_at": "2026-08-07",
    "notes": "Evidence changes exploit weighting, not source truth."
  },
  {
    "claim_id": "LCM-10-CL-002",
    "module_id": "evidence",
    "claim": "A single showdown can establish that a hand-line combination exists but cannot by itself establish its frequency or justify a high-confidence population magnitude.",
    "source_refs": ["governance/CROSS_SOURCE_VALIDATION_AND_ADMISSION_FRAMEWORK_v0_1.md#field-evidence-interaction", "sources/cash-injection/source-registry.md"],
    "interpretation": "One observation should create a note or low-confidence hypothesis, not an automatic range rewrite or universal exploit.",
    "claim_type": "SIMPLIFICATION",
    "confidence": "HIGH",
    "assumptions": ["Only one relevant observation is available", "No independent sample establishes the frequency"],
    "exceptions": ["A single observation can still disprove an absolute claim that the line is impossible"],
    "target_games": ["Live cash 1/3", "Live cash 2/5"],
    "depth_scope": ["All depths"],
    "positions": ["All positions"],
    "player_count_scope": "BOTH",
    "sizing_scope": ["All observed branches"],
    "rake_or_structure_notes": [],
    "conflicts": [],
    "ip_purity_status": "PRODUCT_SAFE_CANDIDATE",
    "status": "ADMITTED",
    "reviewer": "GPT-5.6 Thinking",
    "reviewed_at": "2026-08-07",
    "notes": "Epistemic guardrail, not a statistical sample-size theorem."
  },
  {
    "claim_id": "LCM-10-CL-003",
    "module_id": "evidence",
    "claim": "Source-backed population tendencies may guide attention before a local sample exists, but their magnitude must remain uncertain until the target environment or opponent provides supporting evidence.",
    "source_refs": ["sources/cash-injection/transcripts/CINJ_E05_origin_range_width_and_bluff_density.md", "sources/cash-injection/transcripts/CINJ_E10_exploitative_folding_in_filtered_underbluffed_nodes.md", "governance/CROSS_SOURCE_VALIDATION_AND_ADMISSION_FRAMEWORK_v0_1.md#field-evidence-interaction"],
    "interpretation": "Use a structural baseline plus a low-confidence prior; do not present source population claims as proven Batumi frequencies.",
    "claim_type": "HEURISTIC",
    "confidence": "HIGH",
    "assumptions": ["The source mechanism is admitted", "The target pool has not yet been directly validated"],
    "exceptions": ["Repeated local evidence can increase confidence and exploit weighting"],
    "target_games": ["Live cash 1/3", "Live cash 2/5", "Batumi live cash"],
    "depth_scope": ["All depths"],
    "positions": ["All positions"],
    "player_count_scope": "BOTH",
    "sizing_scope": ["Population-sensitive branches"],
    "rake_or_structure_notes": [],
    "conflicts": ["Population magnitude remains field-gated"],
    "ip_purity_status": "PRODUCT_SAFE_CANDIDATE",
    "status": "ADMITTED",
    "reviewer": "GPT-5.6 Thinking",
    "reviewed_at": "2026-08-07",
    "notes": "Separates mechanism from environment magnitude."
  },
  {
    "claim_id": "LCM-10-CL-004",
    "module_id": "evidence",
    "claim": "Field evidence may change priority, exploit weighting and exception prominence but must not silently rewrite an admitted source claim or unresolved theoretical boundary.",
    "source_refs": ["governance/CROSS_SOURCE_VALIDATION_AND_ADMISSION_FRAMEWORK_v0_1.md#field-evidence-interaction"],
    "interpretation": "Observed hands refine the environment model while preserving the distinction between theory, inference and field calibration.",
    "claim_type": "BASELINE",
    "confidence": "HIGH",
    "assumptions": ["The project distinguishes source claims from field observations", "Field notes can be reviewed and scoped"],
    "exceptions": ["Enough new evidence can trigger a formal claim re-review through the admission process"],
    "target_games": ["Live cash 1/3", "Live cash 2/5"],
    "depth_scope": ["All depths"],
    "positions": ["Learning and review workflow"],
    "player_count_scope": "NOT_APPLICABLE",
    "sizing_scope": ["Evidence governance"],
    "rake_or_structure_notes": [],
    "conflicts": [],
    "ip_purity_status": "PRODUCT_SAFE_CANDIDATE",
    "status": "ADMITTED",
    "reviewer": "GPT-5.6 Thinking",
    "reviewed_at": "2026-08-07",
    "notes": "Governance rule."
  }
]
