[
  {
    "claim_id": "LCM-02-CL-001",
    "module_id": "preflop",
    "claim": "Preflop charts should be treated as baseline range shapes whose branch changes with position, depth, open size, rake and the players left to act.",
    "source_refs": [
      "sources/smash-live-cash/transcripts/SLC_M01_L01_preflop_101.md#preflop-master-sheet-and-baseline-philosophy",
      "sources/ftgu/transcripts/FTGU_E15_polar_vs_linear_3betting.md"
    ],
    "interpretation": "The trainer should teach a compact decision architecture around the baseline rather than require memorisation of every mixed chart cell.",
    "claim_type": "SIMPLIFICATION",
    "confidence": "HIGH",
    "assumptions": ["The learner has a reasonable baseline range shape", "Exact chart weights are not required for the current decision"],
    "exceptions": ["Exact hand boundaries and frequencies remain visual-dependent", "Large rake or unusual sizing can move marginal hands across the boundary"],
    "target_games": ["Live cash 1/3", "Live cash 2/5", "Straddled live cash"],
    "depth_scope": ["100bb", "150-200bb", "300-400bb and deeper"],
    "positions": ["All positions"],
    "player_count_scope": "BOTH",
    "sizing_scope": ["Open, call, 3-bet and squeeze branches"],
    "rake_or_structure_notes": ["Rake, ante/no-ante and straddle structure materially change range shape"],
    "conflicts": [],
    "ip_purity_status": "PRODUCT_SAFE_CANDIDATE",
    "status": "ADMITTED",
    "reviewer": "GPT-5.6 Thinking",
    "reviewed_at": "2026-08-07",
    "notes": "No exact chart cells are reproduced."
  },
  {
    "claim_id": "LCM-02-CL-002",
    "module_id": "preflop",
    "claim": "A poor passive call does not automatically create a profitable bluff 3-bet; the raised branch must be evaluated against the stronger range that continues.",
    "source_refs": [
      "sources/ftgu/transcripts/FTGU_E06_sb_3bet_or_fold_strategies.md",
      "sources/ftgu/transcripts/FTGU_E15_polar_vs_linear_3betting.md"
    ],
    "interpretation": "Call, 3-bet and fold are separate branches. Initiative is not a sufficient reason to convert a marginal hand into aggression.",
    "claim_type": "BASELINE",
    "confidence": "HIGH",
    "assumptions": ["Villain's continuing range becomes stronger after facing the 3-bet", "No special read creates exceptional fold equity"],
    "exceptions": ["A hand can still become a bluff 3-bet when it gains enough from folds and has useful blockers/equity"],
    "target_games": ["Live cash 1/3", "Live cash 2/5"],
    "depth_scope": ["All depths, with node-specific thresholds"],
    "positions": ["All positions, especially SB and squeeze branches"],
    "player_count_scope": "BOTH",
    "sizing_scope": ["3-bet and squeeze branches"],
    "rake_or_structure_notes": ["Rake can reduce the value of marginal passive calls"],
    "conflicts": [],
    "ip_purity_status": "PRODUCT_SAFE_CANDIDATE",
    "status": "ADMITTED",
    "reviewer": "GPT-5.6 Thinking",
    "reviewed_at": "2026-08-07",
    "notes": "Mechanism claim only; no fixed combo prescription."
  },
  {
    "claim_id": "LCM-02-CL-003",
    "module_id": "preflop",
    "claim": "When live opponents enter too widely, a disciplined squeeze exploit increases the use of existing mixed candidates before inventing new bluff combinations.",
    "source_refs": [
      "sources/smash-live-cash/transcripts/SLC_M01_L02_preflop_squeezing.md#exploit-by-purifying-existing-mixes",
      "sources/ftgu/transcripts/FTGU_E15_polar_vs_linear_3betting.md"
    ],
    "interpretation": "Exploit expansion should preserve coherent range shape: increase justified candidates with fold equity and playability rather than add arbitrary suited hands.",
    "claim_type": "EXPLOIT",
    "confidence": "HIGH",
    "assumptions": ["Opponent open/call ranges are genuinely wider than baseline", "The candidate already exists in a defensible mixed or polar 3-bet region"],
    "exceptions": ["If opponents continue too much, the range should shift more linear rather than add polar bluffs", "Exact candidate weights remain visual-dependent"],
    "target_games": ["Live cash 1/3", "Live cash 2/5"],
    "depth_scope": ["100bb", "200bb and deeper"],
    "positions": ["Squeeze positions"],
    "player_count_scope": "MULTIWAY",
    "sizing_scope": ["Open plus call facing a squeeze"],
    "rake_or_structure_notes": [],
    "conflicts": [],
    "ip_purity_status": "PRODUCT_SAFE_CANDIDATE",
    "status": "ADMITTED",
    "reviewer": "GPT-5.6 Thinking",
    "reviewed_at": "2026-08-07",
    "notes": "Exact positions, sizes and combo weights remain claim-gated."
  },
  {
    "claim_id": "LCM-02-CL-004",
    "module_id": "preflop",
    "claim": "Deeper stacks increase the value of suited playability and protected flats, while shorter stacks shift more weight toward direct linear aggression and earlier stack commitment.",
    "source_refs": [
      "sources/smash-live-cash/transcripts/SLC_M01_L02_preflop_squeezing.md#depth-changes-flatting-and-squeezing",
      "sources/smash-live-cash/transcripts/SLC_M01_L03_preflop_adjustments.md",
      "sources/smash-live-cash/transcripts/SLC_M01_L01_preflop_101.md#depth-changes-3-bet-and-squeeze-sizes"
    ],
    "interpretation": "The trainer should teach the directional depth shift without pretending to know an exact stack threshold or hand matrix from audio alone.",
    "claim_type": "HEURISTIC",
    "confidence": "MEDIUM",
    "assumptions": ["Same positions and broadly similar opponent model", "No extreme rake or sizing discontinuity"],
    "exceptions": ["Exact stack-off thresholds and hand frequencies remain visual-dependent", "Opponent-specific folds can override the baseline direction"],
    "target_games": ["Live cash 1/3", "Live cash 2/5", "Deep live cash"],
    "depth_scope": ["Directional depth comparison only", "Direct source examples at 100bb, 200bb and 400bb; no exact transition threshold is admitted"],
    "positions": ["All positions"],
    "player_count_scope": "BOTH",
    "sizing_scope": ["3-bet, squeeze and versus-4-bet branches"],
    "rake_or_structure_notes": ["Straddle changes the working depth unit"],
    "conflicts": ["Exact depth overlays remain open and must not be inferred from this directional claim"],
    "ip_purity_status": "PRODUCT_SAFE_CANDIDATE",
    "status": "ADMITTED",
    "reviewer": "GPT-5.6 Thinking",
    "reviewed_at": "2026-08-07",
    "notes": "Directional heuristic only; 100bb/200bb/400bb are source examples, not universal transition boundaries."
  }
]
